name,description,location_lat,location_lon,category,images
Agra,A historical city known for the Agra Fort, Mughal architecture, and rich cultural heritage,27.1767,78.0421,city,["https://upload.wikimedia.org/wikipedia/commons/1/1f/Agra_Fort_India.jpg", "https://upload.wikimedia.org/wikipedia/commons/7/79/Agra_India_Yamuna_River.jpg"]**
Goa,A coastal state known for its beaches, nightlife, and Portuguese heritage,15.4979,73.8278,beach,["https://upload.wikimedia.org/wikipedia/commons/9/93/Calangute_Beach_Goa_India.jpg", "https://upload.wikimedia.org/wikipedia/commons/e/e2/Anjuna_beach_goa.jpg"]
Jaipur,The Pink City, known for its forts, palaces, and vibrant culture,26.9124,75.7880,city,["https://upload.wikimedia.org/wikipedia/commons/c/ce/Hawa_Mahal_India.jpg", "https://upload.wikimedia.org/wikipedia/commons/thumb/e/e1/Amber_Fort_Jaipur_India.jpg/1200px-Amber_Fort_Jaipur_India.jpg"]
Kerala,A state known for its backwaters, beaches, and lush greenery,9.9312,76.2673,state,["https://upload.wikimedia.org/wikipedia/commons/thumb/5/53/Munnar_-_The_Kashmir_of_South_India_-_03106.jpg/1200px-Munnar_-_The_Kashmir_of_South_India_-_03106.jpg", "https://upload.wikimedia.org/wikipedia/commons/thumb/0/0c/Alleppey_Backwaters_Kerala_India.jpg/1200px-Alleppey_Backwaters_Kerala_India.jpg"]
Darjeeling,A hill station known for its scenic beauty, Himalayan views, and toy train,27.0360,88.2630,hill station,["https://upload.wikimedia.org/wikipedia/commons/thumb/1/10/Darjeeling_Himalaian_Railway.jpg/1200px-Darjeeling_Himalaian_Railway.jpg", "https://upload.wikimedia.org/wikipedia/commons/thumb/5/57/Tiger_Hill_Darjeeling.jpg/1200px-Tiger_Hill_Darjeeling.jpg"]
